Title,URL,Score,Date
Human-level performance via ML was *not* proven impossible with complexity theory [D],https://arxiv.org/abs/2411.06498),134,2026-05-13 14:50:40
Steam Recommender using similarity! (Undergraduate Student Project) [P],https://github.com/BakedSoups/NextSteamGame,92,2026-05-12 17:30:32
Elastic Attention Cores for Scalable Vision Transformers [R],"https://arxiv.org/abs/2605.12491
https://github.com/alansong1322/VECA",37,2026-05-13 11:51:30
Built Support Vector Machine(SVM) from scratch in Rust [P],https://github.com/slyeet03/svm-from-scratch,34,2026-05-13 14:23:55
